{
  "schema_version": 1,
  "tool": "verify_workflow_state",
  "generated_at_utc": "2026-08-01T12:00:00.0000000Z",
  "result": "pass",
  "repository": {"root": "C:\\synthetic\\idle-death", "full_name": "Navandis/idle-death", "origin_url": "https://github.com/Navandis/idle-death", "branch": "main", "head": "1111111111111111111111111111111111111111", "origin_main": "1111111111111111111111111111111111111111", "remote_main": "1111111111111111111111111111111111111111", "upstream": "origin/main", "remote_feature_sha": null},
  "tools": {"git_path": "git.exe", "git_version": "git version 2.50.0", "gh_path": "gh.exe", "gh_version": "gh version 2.80.0"},
  "workspace": {"status_entries": [], "staged_paths": [], "publish_request_present": false, "index_lock_present": false},
  "github": {"login": "navandis-automation", "matching_pr_count": 0, "pull_request": null, "check_runs": [{"id": 101, "name": "Godot import and GUT", "status": "completed", "conclusion": "success", "app_id": 15368, "app_name": "GitHub Actions", "app_slug": "github-actions", "details_url": "https://github.com/Navandis/idle-death/actions/runs/101"}], "workflow_runs": [{"id": 101, "name": "Death Idle CI", "number": 3, "attempt": 1, "event": "push", "status": "completed", "conclusion": "success", "head_branch": "main", "head_sha": "1111111111111111111111111111111111111111", "url": "https://github.com/Navandis/idle-death/actions/runs/101"}], "review_threads": {"total_count": 0, "unresolved_count": 0, "items": []}},
  "queries": [{"name": "github.login", "ok": true, "exit_code": 0, "error": null}, {"name": "local.head", "ok": true, "exit_code": 0, "error": null}]
}
