{
  "schema_version": 1,
  "tool": "verify_workflow_state",
  "generated_at_utc": "2026-08-01T12:00:00.0000000Z",
  "result": "pass",
  "repository": {"root": "C:\\synthetic\\idle-death", "full_name": "Navandis/idle-death", "origin_url": "https://github.com/Navandis/idle-death", "branch": "codex/example", "head": "2222222222222222222222222222222222222222", "origin_main": "1111111111111111111111111111111111111111", "remote_main": "1111111111111111111111111111111111111111", "upstream": "origin/codex/example", "remote_feature_sha": "2222222222222222222222222222222222222222"},
  "tools": {"git_path": "git.exe", "git_version": "git version 2.50.0", "gh_path": "gh.exe", "gh_version": "gh version 2.80.0"},
  "workspace": {"status_entries": ["?? tools/codex/verify_workflow_state.ps1"], "staged_paths": [], "publish_request_present": false, "index_lock_present": false},
  "github": {"login": "navandis-automation", "matching_pr_count": 1, "pull_request": {"number": 42, "url": "https://github.com/Navandis/idle-death/pull/42", "state": "open", "draft": true, "mergeable": null, "base_ref": "main", "head_ref": "codex/example", "head_sha": "2222222222222222222222222222222222222222", "author": "navandis-automation", "labels": ["automation", "draft"], "auto_merge": false}, "check_runs": [{"id": 102, "name": "Godot import and GUT", "status": "completed", "conclusion": "success", "app_id": 15368, "app_name": "GitHub Actions", "app_slug": "github-actions", "details_url": "https://github.com/Navandis/idle-death/actions/runs/102"}], "workflow_runs": [{"id": 102, "name": "Death Idle CI", "number": 4, "attempt": 1, "event": "pull_request", "status": "completed", "conclusion": "success", "head_branch": "codex/example", "head_sha": "2222222222222222222222222222222222222222", "url": "https://github.com/Navandis/idle-death/actions/runs/102"}], "review_threads": {"total_count": 2, "unresolved_count": 1, "items": [{"id": "thread-a", "is_resolved": true, "is_outdated": false, "path": "tools/codex/verify_workflow_state.ps1", "line": 20}, {"id": "thread-b", "is_resolved": false, "is_outdated": true, "path": null, "line": null}]}},
  "queries": [{"name": "github.login", "ok": true, "exit_code": 0, "error": null}, {"name": "github.pull_request", "ok": true, "exit_code": 0, "error": null}, {"name": "local.head", "ok": true, "exit_code": 0, "error": null}]
}
